{
  "schema": "aro-demo-v0",
  "task": "analyze a simple task",
  "result": "task completed",
  "persona": {
    "id": "demo-persona",
    "role": "research-agent",
    "permissions": [
      "write_evidence"
    ]
  },
  "timestamp": 1773261546.1382022,
  "agent_id": "crew-demo-agent-001",
  "framework": "CrewAI",
  "execution": {
    "status": "completed",
    "trace": [
      "persona loaded",
      "CrewAI agent executed task",
      "audit evidence generated"
    ]
  },
  "audit": {
    "record_type": "ARO-compatible",
    "evidence_path": "evidence/crew_demo_audit.json"
  },
  "metadata": {
    "llm_model": "mock-crewai-local",
    "task_description": "analyze a simple task",
    "expected_output": "task completed",
    "intent_ref": "interaction/intent.json",
    "action_ref": "interaction/action.json",
    "governance_checkpoint_ref": "governor://checkpoints/demo-local-001",
    "correlation_id": "crew-demo-001"
  }
}
